{
  "attestation_version": "1.0.0",
  "run_id": "run-20260922T221000Z-7a3f7f6a",
  "clock_source": "local",
  "run_started_utc": "2026-09-22T22:10:00Z",
  "run_finished_utc": "2026-09-22T22:10:00Z",
  "offline_assertion": {
    "network_calls_made": false,
    "engine_is_deterministic": true,
    "llm_invoked": false
  },
  "input_id": "ci-3f7a1c2e-9b4d-4a18-8e62-1c0d5f7a9b31",
  "input_sha256": "7a3f7f6aceca4cf105c240b26b298c2b6a9faaa10ca7e50ff293644ae516bef0",
  "rule_pack": {
    "pack_id": "scw-qatar-starter",
    "pack_version": "0.2.0",
    "sha256": "1ea71e863f05f7b8c1c2fd64ce0b58fd03de5a3512e25b15d4bee64451cae042",
    "status": "draft"
  },
  "engine_version": "1.0.0",
  "results_sha256": "22f2f721f0843fba3efbc25e188981a8608ebf7f82f53799b6ea7bb60086008f",
  "verdict_counts": {
    "compliant": 1,
    "non_compliant": 0,
    "doubtful": 3,
    "out_of_coverage": 1,
    "insufficient_input": 1
  },
  "exports": [
    {
      "kind": "csv",
      "filename": "scw-export-run-20260922T221000Z-7a3f7f6a.csv",
      "sha256": "f8fd782aa26616f86a0e07ee8da09e0ee3cbda485420d572f9e9b61b6a2375c4"
    }
  ],
  "reviewer_signoff": {
    "reviewer_name": "",
    "reviewer_role": "",
    "review_date": "",
    "statement": null,
    "completed": false
  },
  "disclaimer": {
    "en": "This workbook is a drafting aid. Its verdicts are proposed worksheet fields generated by a deterministic rule pack; they are not a sharia ruling, not a legal opinion, and not an approval. A qualified human reviewer must complete the sign-off block before any use.",
    "ar": "هذا الدفتر أداة مسودة. الأحكام فيه حقول مقترحة ينتجها رتبة قواعد حتمية؛ وليست فتوى ولا رأيا قانونيا ولا موافقة. يجب أن يكمل المراجع البشري المؤهل خانة التوقيع قبل أي استخدام."
  }
}
