{
  "attestation_version": "1.0.0",
  "run_id": "run-20260922T230200Z-9bbea587",
  "clock_source": "local",
  "run_started_utc": "2026-09-22T23:02:00Z",
  "run_finished_utc": "2026-09-22T23:02:00Z",
  "offline_assertion": {
    "network_calls_made": false,
    "engine_is_deterministic": true,
    "llm_invoked": false
  },
  "input_id": "ci-33333333-3333-4333-8333-333333333333",
  "input_sha256": "9bbea587d3d927afc7edb05086b2e222c5f25cd16f4a07844add9f5c3eba415a",
  "rule_pack": {
    "pack_id": "scw-qatar-starter",
    "pack_version": "0.2.0",
    "sha256": "1ea71e863f05f7b8c1c2fd64ce0b58fd03de5a3512e25b15d4bee64451cae042",
    "status": "draft"
  },
  "engine_version": "1.0.0",
  "results_sha256": "d0dd6156e3f2422ae2afc0d5ceee6d7db763604043c28a673bce65f0dd56f86d",
  "verdict_counts": {
    "compliant": 0,
    "non_compliant": 0,
    "doubtful": 2,
    "out_of_coverage": 0,
    "insufficient_input": 0
  },
  "exports": [
    {
      "kind": "csv",
      "filename": "scw-export-run-20260922T230200Z-9bbea587.csv",
      "sha256": "986fa2e42e6a922bdfeeb1a1f0f29e58679cff287edbdd2fb6511ec5cf132c72"
    }
  ],
  "reviewer_signoff": {
    "reviewer_name": "",
    "reviewer_role": "",
    "review_date": "",
    "statement": null,
    "completed": false
  },
  "disclaimer": {
    "en": "This workbook is a drafting aid. Its verdicts are proposed worksheet fields generated by a deterministic rule pack; they are not a sharia ruling, not a legal opinion, and not an approval. A qualified human reviewer must complete the sign-off block before any use.",
    "ar": "هذا الدفتر أداة مسودة. الأحكام فيه حقول مقترحة ينتجها رتبة قواعد حتمية؛ وليست فتوى ولا رأيا قانونيا ولا موافقة. يجب أن يكمل المراجع البشري المؤهل خانة التوقيع قبل أي استخدام."
  }
}
