{
  "attestation_version": "1.0.0",
  "run_id": "run-20260922T221200Z-2b935fef",
  "clock_source": "local",
  "run_started_utc": "2026-09-22T22:12:00Z",
  "run_finished_utc": "2026-09-22T22:12:00Z",
  "offline_assertion": {
    "network_calls_made": false,
    "engine_is_deterministic": true,
    "llm_invoked": false
  },
  "input_id": "ci-8d20b6f4-5c3e-4f9a-b1d7-6a92e4c08d55",
  "input_sha256": "2b935fefe3add4d6373f092e43542a95e274a804d6dc3b966ac4b367f2c0a6fe",
  "rule_pack": {
    "pack_id": "scw-qatar-starter",
    "pack_version": "0.2.0",
    "sha256": "1ea71e863f05f7b8c1c2fd64ce0b58fd03de5a3512e25b15d4bee64451cae042",
    "status": "draft"
  },
  "engine_version": "1.0.0",
  "results_sha256": "06c1924f05b81a3169e12c94f0f10ad5646606df1482f18c8c0c9bff812c9b53",
  "verdict_counts": {
    "compliant": 0,
    "non_compliant": 0,
    "doubtful": 3,
    "out_of_coverage": 0,
    "insufficient_input": 0
  },
  "exports": [
    {
      "kind": "csv",
      "filename": "scw-export-run-20260922T221200Z-2b935fef.csv",
      "sha256": "635e17e931e6dbf14f1a28aa79b192d095b0a6a0968d903e1d6c87a941dcb8a1"
    }
  ],
  "reviewer_signoff": {
    "reviewer_name": "",
    "reviewer_role": "",
    "review_date": "",
    "statement": null,
    "completed": false
  },
  "disclaimer": {
    "en": "This workbook is a drafting aid. Its verdicts are proposed worksheet fields generated by a deterministic rule pack; they are not a sharia ruling, not a legal opinion, and not an approval. A qualified human reviewer must complete the sign-off block before any use.",
    "ar": "هذا الدفتر أداة مسودة. الأحكام فيه حقول مقترحة ينتجها رتبة قواعد حتمية؛ وليست فتوى ولا رأيا قانونيا ولا موافقة. يجب أن يكمل المراجع البشري المؤهل خانة التوقيع قبل أي استخدام."
  }
}
